{
  "format": "tvbt-recursive-proof-state-v1",
  "scope": {
    "dataset_id": "synthetic",
    "data_revision": "sha256:aaaaaaaaaaaaaaaaaaaaaaaaaaaaaaaaaaaaaaaaaaaaaaaaaaaaaaaaaaaaaaaa",
    "decomposition_id": "fixed-synthetic",
    "rule_version": "fixed_same_level_recursive_v2"
  },
  "cursor": 15,
  "facts": [
    {
      "ref": {
        "object_id": "movement-0",
        "object_revision": 1
      },
      "scope": {
        "dataset_id": "synthetic",
        "data_revision": "sha256:aaaaaaaaaaaaaaaaaaaaaaaaaaaaaaaaaaaaaaaaaaaaaaaaaaaaaaaaaaaaaaaa",
        "decomposition_id": "fixed-synthetic",
        "rule_version": "fixed_same_level_recursive_v2"
      },
      "level": 0,
      "kind": "movement",
      "start": {
        "bar_index": 0,
        "time": 1000,
        "price_i64": 90
      },
      "end": {
        "bar_index": 3,
        "time": 4000,
        "price_i64": 120
      },
      "low_i64": 90,
      "high_i64": 120,
      "low_source_bar_index": 0,
      "high_source_bar_index": 3,
      "known_at_bar_index": 15
    },
    {
      "ref": {
        "object_id": "movement-1",
        "object_revision": 1
      },
      "scope": {
        "dataset_id": "synthetic",
        "data_revision": "sha256:aaaaaaaaaaaaaaaaaaaaaaaaaaaaaaaaaaaaaaaaaaaaaaaaaaaaaaaaaaaaaaaa",
        "decomposition_id": "fixed-synthetic",
        "rule_version": "fixed_same_level_recursive_v2"
      },
      "level": 0,
      "kind": "movement",
      "start": {
        "bar_index": 3,
        "time": 4000,
        "price_i64": 120
      },
      "end": {
        "bar_index": 6,
        "time": 7000,
        "price_i64": 100
      },
      "low_i64": 100,
      "high_i64": 120,
      "low_source_bar_index": 6,
      "high_source_bar_index": 3,
      "known_at_bar_index": 15
    },
    {
      "ref": {
        "object_id": "movement-2",
        "object_revision": 1
      },
      "scope": {
        "dataset_id": "synthetic",
        "data_revision": "sha256:aaaaaaaaaaaaaaaaaaaaaaaaaaaaaaaaaaaaaaaaaaaaaaaaaaaaaaaaaaaaaaaa",
        "decomposition_id": "fixed-synthetic",
        "rule_version": "fixed_same_level_recursive_v2"
      },
      "level": 0,
      "kind": "movement",
      "start": {
        "bar_index": 6,
        "time": 7000,
        "price_i64": 100
      },
      "end": {
        "bar_index": 9,
        "time": 10000,
        "price_i64": 115
      },
      "low_i64": 100,
      "high_i64": 115,
      "low_source_bar_index": 6,
      "high_source_bar_index": 9,
      "known_at_bar_index": 15
    },
    {
      "ref": {
        "object_id": "segment-0",
        "object_revision": 1
      },
      "scope": {
        "dataset_id": "synthetic",
        "data_revision": "sha256:aaaaaaaaaaaaaaaaaaaaaaaaaaaaaaaaaaaaaaaaaaaaaaaaaaaaaaaaaaaaaaaa",
        "decomposition_id": "fixed-synthetic",
        "rule_version": "fixed_same_level_recursive_v2"
      },
      "level": -1,
      "kind": "segment",
      "start": {
        "bar_index": 0,
        "time": 1000,
        "price_i64": 90
      },
      "end": {
        "bar_index": 1,
        "time": 2000,
        "price_i64": 110
      },
      "low_i64": 90,
      "high_i64": 110,
      "low_source_bar_index": 0,
      "high_source_bar_index": 1,
      "known_at_bar_index": 2
    },
    {
      "ref": {
        "object_id": "segment-1",
        "object_revision": 1
      },
      "scope": {
        "dataset_id": "synthetic",
        "data_revision": "sha256:aaaaaaaaaaaaaaaaaaaaaaaaaaaaaaaaaaaaaaaaaaaaaaaaaaaaaaaaaaaaaaaa",
        "decomposition_id": "fixed-synthetic",
        "rule_version": "fixed_same_level_recursive_v2"
      },
      "level": -1,
      "kind": "segment",
      "start": {
        "bar_index": 1,
        "time": 2000,
        "price_i64": 110
      },
      "end": {
        "bar_index": 2,
        "time": 3000,
        "price_i64": 95
      },
      "low_i64": 95,
      "high_i64": 110,
      "low_source_bar_index": 2,
      "high_source_bar_index": 1,
      "known_at_bar_index": 3
    },
    {
      "ref": {
        "object_id": "segment-2",
        "object_revision": 1
      },
      "scope": {
        "dataset_id": "synthetic",
        "data_revision": "sha256:aaaaaaaaaaaaaaaaaaaaaaaaaaaaaaaaaaaaaaaaaaaaaaaaaaaaaaaaaaaaaaaa",
        "decomposition_id": "fixed-synthetic",
        "rule_version": "fixed_same_level_recursive_v2"
      },
      "level": -1,
      "kind": "segment",
      "start": {
        "bar_index": 2,
        "time": 3000,
        "price_i64": 95
      },
      "end": {
        "bar_index": 3,
        "time": 4000,
        "price_i64": 120
      },
      "low_i64": 95,
      "high_i64": 120,
      "low_source_bar_index": 2,
      "high_source_bar_index": 3,
      "known_at_bar_index": 4
    },
    {
      "ref": {
        "object_id": "segment-3",
        "object_revision": 1
      },
      "scope": {
        "dataset_id": "synthetic",
        "data_revision": "sha256:aaaaaaaaaaaaaaaaaaaaaaaaaaaaaaaaaaaaaaaaaaaaaaaaaaaaaaaaaaaaaaaa",
        "decomposition_id": "fixed-synthetic",
        "rule_version": "fixed_same_level_recursive_v2"
      },
      "level": -1,
      "kind": "segment",
      "start": {
        "bar_index": 3,
        "time": 4000,
        "price_i64": 120
      },
      "end": {
        "bar_index": 4,
        "time": 5000,
        "price_i64": 110
      },
      "low_i64": 110,
      "high_i64": 120,
      "low_source_bar_index": 4,
      "high_source_bar_index": 3,
      "known_at_bar_index": 5
    },
    {
      "ref": {
        "object_id": "segment-4",
        "object_revision": 1
      },
      "scope": {
        "dataset_id": "synthetic",
        "data_revision": "sha256:aaaaaaaaaaaaaaaaaaaaaaaaaaaaaaaaaaaaaaaaaaaaaaaaaaaaaaaaaaaaaaaa",
        "decomposition_id": "fixed-synthetic",
        "rule_version": "fixed_same_level_recursive_v2"
      },
      "level": -1,
      "kind": "segment",
      "start": {
        "bar_index": 4,
        "time": 5000,
        "price_i64": 110
      },
      "end": {
        "bar_index": 5,
        "time": 6000,
        "price_i64": 120
      },
      "low_i64": 110,
      "high_i64": 120,
      "low_source_bar_index": 4,
      "high_source_bar_index": 5,
      "known_at_bar_index": 6
    },
    {
      "ref": {
        "object_id": "segment-5",
        "object_revision": 1
      },
      "scope": {
        "dataset_id": "synthetic",
        "data_revision": "sha256:aaaaaaaaaaaaaaaaaaaaaaaaaaaaaaaaaaaaaaaaaaaaaaaaaaaaaaaaaaaaaaaa",
        "decomposition_id": "fixed-synthetic",
        "rule_version": "fixed_same_level_recursive_v2"
      },
      "level": -1,
      "kind": "segment",
      "start": {
        "bar_index": 5,
        "time": 6000,
        "price_i64": 120
      },
      "end": {
        "bar_index": 6,
        "time": 7000,
        "price_i64": 100
      },
      "low_i64": 100,
      "high_i64": 120,
      "low_source_bar_index": 6,
      "high_source_bar_index": 5,
      "known_at_bar_index": 7
    },
    {
      "ref": {
        "object_id": "segment-6",
        "object_revision": 1
      },
      "scope": {
        "dataset_id": "synthetic",
        "data_revision": "sha256:aaaaaaaaaaaaaaaaaaaaaaaaaaaaaaaaaaaaaaaaaaaaaaaaaaaaaaaaaaaaaaaa",
        "decomposition_id": "fixed-synthetic",
        "rule_version": "fixed_same_level_recursive_v2"
      },
      "level": -1,
      "kind": "segment",
      "start": {
        "bar_index": 6,
        "time": 7000,
        "price_i64": 100
      },
      "end": {
        "bar_index": 7,
        "time": 8000,
        "price_i64": 110
      },
      "low_i64": 100,
      "high_i64": 110,
      "low_source_bar_index": 6,
      "high_source_bar_index": 7,
      "known_at_bar_index": 8
    },
    {
      "ref": {
        "object_id": "segment-7",
        "object_revision": 1
      },
      "scope": {
        "dataset_id": "synthetic",
        "data_revision": "sha256:aaaaaaaaaaaaaaaaaaaaaaaaaaaaaaaaaaaaaaaaaaaaaaaaaaaaaaaaaaaaaaaa",
        "decomposition_id": "fixed-synthetic",
        "rule_version": "fixed_same_level_recursive_v2"
      },
      "level": -1,
      "kind": "segment",
      "start": {
        "bar_index": 7,
        "time": 8000,
        "price_i64": 110
      },
      "end": {
        "bar_index": 8,
        "time": 9000,
        "price_i64": 100
      },
      "low_i64": 100,
      "high_i64": 110,
      "low_source_bar_index": 8,
      "high_source_bar_index": 7,
      "known_at_bar_index": 9
    },
    {
      "ref": {
        "object_id": "segment-8",
        "object_revision": 1
      },
      "scope": {
        "dataset_id": "synthetic",
        "data_revision": "sha256:aaaaaaaaaaaaaaaaaaaaaaaaaaaaaaaaaaaaaaaaaaaaaaaaaaaaaaaaaaaaaaaa",
        "decomposition_id": "fixed-synthetic",
        "rule_version": "fixed_same_level_recursive_v2"
      },
      "level": -1,
      "kind": "segment",
      "start": {
        "bar_index": 8,
        "time": 9000,
        "price_i64": 100
      },
      "end": {
        "bar_index": 9,
        "time": 10000,
        "price_i64": 115
      },
      "low_i64": 100,
      "high_i64": 115,
      "low_source_bar_index": 8,
      "high_source_bar_index": 9,
      "known_at_bar_index": 10
    },
    {
      "ref": {
        "object_id": "synthetic-boundary",
        "object_revision": 1
      },
      "scope": {
        "dataset_id": "synthetic",
        "data_revision": "sha256:aaaaaaaaaaaaaaaaaaaaaaaaaaaaaaaaaaaaaaaaaaaaaaaaaaaaaaaaaaaaaaaa",
        "decomposition_id": "fixed-synthetic",
        "rule_version": "fixed_same_level_recursive_v2"
      },
      "level": -1,
      "kind": "completion",
      "start": {
        "bar_index": 9,
        "time": 10000,
        "price_i64": 115
      },
      "end": {
        "bar_index": 10,
        "time": 11000,
        "price_i64": 110
      },
      "low_i64": 110,
      "high_i64": 115,
      "low_source_bar_index": 10,
      "high_source_bar_index": 9,
      "known_at_bar_index": 15
    }
  ],
  "claims": [